Id,Sentiment,Pasangan Calon,Tweet,preprocessing,preprobaru
661,negative,Anies-Sandi,Kapan nih om @ruhutsitompul potong telinga #AniesSandiDKI1 #AniesSandi #islam @ILC_tvOnenews @aniesbaswedan,nih om ruhutsitompul potong telinga aniessandidki aniessandi islam indonesia lawyers club tvonenews aniesbaswedan,nih om ruhutsitompul potong telinga aniessandidki aniessandi islam indonesia lawyers club tvonenews aniesbaswedan
662,negative,Anies-Sandi,"#AniesSandi mampu beretorika sangat indah, DP0% TERNYATA BAYAR 6 BULAN PERTAMA DNG CICILAN LUMAYAN, DAN ITU RUMAH SUSUN,",aniessandi retorika indah uang muka bayar pe sama dengan cicil lumayan rumah susun,aniessandi retorika indah uang muka bayar pe cicil lumayan rumah susun
663,negative,Anies-Sandi,"Anies-Sandi Pimpin Ibu Kota, FPI akan Semakin Bertaring http://bit.ly/2p1mdBW  #PilkadaDKI #AniesSandi #FPI",anies sandi pimpin kota front pembela islam be aring pilkadadki aniessandi front pembela islam,anies sandi pimpin kota front bela islam be aring pilkadadki aniessandi front bela islam
664,negative,Anies-Sandi,"Sudah Curang, Kalah, itulah kekalahan yang sangat menyakitkan, Tidak bermartabat dan memalukan #politiksembako #pilkadajakarta #AniesSandi",curang kalah kalah sakit berma abat malu politiksembako pilkadajaka a aniessandi,curang kalah kalah sakit berma abat malu politiksembako pilkadajaka a aniessandi
665,negative,Anies-Sandi,"DP 0 persen ternyata beda dengan DP 0 rupiah, #AniesSandi #QEREN. lha bukannya sama2 0 ?lha 0 persen dari 350jt kan 0 rupiah ?atau beda ?",uang muka persen beda uang muka rupiah aniessandi qeren lah lah persen juta rupiah beda,uang muka persen beda uang muka rupiah aniessandi qeren persen juta rupiah beda
666,negative,Anies-Sandi,Hanya okee oce #okeoce solusi nya Cuma itu saja,okee oke oke oce solusi nya,okee oke oke oke solusi nya
667,negative,Anies-Sandi,Mendapat surga itu tidak semudah tinggal nyoblos #AniesSandi #justsaying,surga mudah tinggal mencoblos aniessandi justsaying,surga mudah tinggal coblos aniessandi justsaying
668,negative,Anies-Sandi,"Kadang lucu, milih #AniesSandi aja kagak tapi nagih minta rumah DP0% situ pada sehat dan waras??",kadang lucu memilih aniessandi saja tidak menagih rumah uang muka situ sehat waras,kadang lucu pilih aniessandi tagih rumah uang muka situ sehat waras
669,negative,Anies-Sandi,Kasihan katanya anti reklamasi tapi kok diteruskan? Ayo dapat berapa uang bapak2 gub & wagub baru jkt? #aniessandi #bullshit #freak,kasihan anti reklamasi terus ayo uang gubernur wakil gubernur jakarta aniessandi bullshit freak,kasihan anti reklamasi ayo uang gubernur wakil gubernur jaka a aniessandi bullshit freak
670,negative,Anies-Sandi,Saran untuk #AniesSandi merealisir Transportasi terintegrasi Tiket Rp.5000 seyogianya dibicarakan dengan @PT_TransJakarta & ORGANDA & MTI,saran aniessandi merealisir transpo asi integrasi tiket rupiah yogia bicara pt transjaka a organda mati,saran aniessandi merealisir transpo asi integrasi tiket rupiah yogia bicara pt transjaka a organda mati
671,negative,Anies-Sandi,Menyambut kemenangan #aniessandi bbrp Alumni212 mencukur rambut ramai2 sambil bersolawat Duhâ€¦,sambut menang aniessandi beberapa alumni cukur rambut ramai bersolawat aduh,sambut menang aniessandi alumni cukur rambut ramai bersolawat aduh
672,negative,Anies-Sandi,"yang penting janji2 rmh dp 0% n bantuan modal cepat cairkan. Kalo bohong, asset2 #AniesSandi hrs dijual untuk rakyat sesuai komitmen",janji rumah uang muka dan bantu modal cepat cair kalau bohong aset aniessandi harus jual rakyat sesuai komitmen,janji rumah uang muka bantu modal cepat cair bohong aset aniessandi jual rakyat sesuai komitmen
673,negative,Anies-Sandi,"Prabowo: Terima Kasih, Habib Rizieq https://kumparan.com #PilkadaDKI #AniesSandi #TerimaKasihUlama #TerimaKasihHabib #AllahuAkbar",prabowo terima kasih habib rizieq pilkadadki aniessandi terimakasihulama terimakasihhabib allahu akbar,prabowo terima kasih habib rizieq pilkadadki aniessandi terimakasihulama terimakasihhabib allahu akbar
674,negative,Anies-Sandi,"Apa cuma Gue disini yang ngerasa banyak omong kosong dari sebelah pihak?, Gak terima kalah? Atau gak terima #AniesSandi menang? #PilkadaDKI",gue merasa omong kosong belah tidak terima kalah tidak terima aniessandi menang pilkadadki,gue omong kosong belah terima kalah terima aniessandi menang pilkadadki
675,negative,Anies-Sandi,AKU titip JAYAKARTA @salimafillah #aniessandi,titip jayaka a salimafillah aniessandi,titip jayaka a salimafillah aniessandi
676,negative,Anies-Sandi,Yang potong payudara/susu jika #AniesSandi menang kira2 gmana ini hahah . Hitz skali wkwkwk pak @basuki_btp ?,potong payudara susu aniessandi menang bagaimana haha hitz sekali wkwk basuki ahok,potong payudara susu aniessandi menang haha hitz wkwk basuki ahok
677,negative,Anies-Sandi,Prabowo Subianto sebut Amin Rais sebagai Ayatollah Indonesia & Aburizal Bakrie sebagai mentor & arsitek pemenangan #AniesSandi #PilkadaDKI,prabowo subianto amin rais ayatollah indonesia aburizal bakrie mentor arsitek menang aniessandi pilkadadki,prabowo subianto amin rais ayatollah indonesia aburizal bakrie mentor arsitek menang aniessandi pilkadadki
678,negative,Anies-Sandi,Kasus #AhokPenistaAgama bukan urusan timses #AniesSandi tapi urusan umat Islam sedunia & aparat penegak hukum Indonesia. #PenjarakanAhok!,ahokpenistaagama urus tim sukses aniessandi urus umat islam dunia aparat tegak hukum indonesia penjarakan ahok,ahokpenistaagama urus tim sukses aniessandi urus umat islam dunia aparat tegak hukum indonesia penjara ahok
679,negative,Anies-Sandi,"#AniesSandi menang, pendukungnya puji syukur,#AhokDjarot kalah, pendukungnya nangis.Gak kbayang kalo Anies kalah, apa ada aksi2 & demo lagi?",aniessandi menang dukung puji syukur ahok djarot kalah dukung di tidak kbayang kalau anies kalah aksi demo,aniessandi menang dukung puji syukur ahok djarot kalah dukung kbayang anies kalah aksi demo
680,negative,Anies-Sandi,"Bismillah beli rumah DP 0%, awas aja program ga jadi jalan #GubernurBaru #aniessandi",bismillah beli rumah uang muka awas saja program tidak jalan gubernurbaru aniessandi,bismillah beli rumah uang muka awas program jalan gubernurbaru aniessandi
681,negative,Anies-Sandi,Kita mencari PELAYAN MASYARAKAT bukan PEMENANG PILKADA. #AhokDjarot #AniesSandi,cari layan masyarakat menang pilihan kepala daerah ahok djarot aniessandi,cari layan masyarakat menang pilih kepala daerah ahok djarot aniessandi
682,negative,Anies-Sandi,"Heran baca berita @liputan6dotcom berita #AniesSandi negatif terus, pantes portal beritanya sepi melempem. Payah!",heran baca berita liput dotcom berita aniessandi negatif pantas po al berita sepi melempem payah,heran baca berita liput dotcom berita aniessandi negatif po al berita sepi melempem payah
683,negative,Anies-Sandi,"#AniesSandi berpihak atau tidak, adil atau tidak, bisa dilihat kok nanti dari titik2 Iklan di DKI. Di dominasi media @Hary_Tanoe atau tidak!",aniessandi pihak adil titik iklan daerah khusus ibukota dominasi media hary tanoe,aniessandi adil titik iklan daerah khusus ibu kota dominasi media hary tanoe
684,negative,Anies-Sandi,Andai saja ahok muslim pasti menang.. #pilkadaDKI #AhokDjarot #AniesSandi,andai ahok muslim menang pilkadadki ahok djarot aniessandi,andai ahok muslim menang pilkadadki ahok djarot aniessandi
685,negative,Anies-Sandi,Ente Kafirun nantangin laskar #AniesSandi ??! Kite cari ente !! #JakartaBersyariah https://twitter.com,kamu kafirun menantang laskar aniessandi kita cari kamu jaka abersyariah,kafirun tantang laskar aniessandi cari jaka abersyariah
686,negative,Anies-Sandi,"BIADAB !!! Kelakuan Kelompok Pendukung #AniesSandi Melebihi ""PENJAJAH"" & Terbukti Melampaui Kemampuan IBLIS #GueCintaNKRI #MasjidUntukSemua",biadab laku kelompok dukung aniessandi lebih jajah bukti lampau mampu iblis guecintankri masjiduntuksemua,biadab laku kelompok dukung aniessandi jajah bukti lampau iblis guecintankri masjiduntuksemua
687,negative,Anies-Sandi,kelakuan busuk lalu beri alasan busuk. sekarang lempar tai sembunyi tangan lalu nunjuk yang lain. MEMALUKAN klakuan pendukung #AniesSandi,laku busuk alas busuk lempar tai sembunyi tangan menunjuk malu kelakuan dukung aniessandi,laku busuk alas busuk lempar tai sembunyi tangan malu laku dukung aniessandi
688,negative,Anies-Sandi,kasian.. masjid dijadikan alat tempat balas dendam.. takbir dilontarkan untuk memuaskan kebencian.. benar2 PARAH pendukung #AniesSandi,kasih masjid jadi alat balas dendam takbir lontar muas benci parah dukung aniessandi,kasih masjid alat balas dendam takbir lontar muas benci parah dukung aniessandi
689,negative,Anies-Sandi,Sangat Buruknya Klakuan Pndukung #AniesSandi Stelah Ceramah Politik di Masjid Lanjut Takbir Pengusiran Djarot dri Masjid,buruk kelakuan pendukung aniessandi setelah ceramah politik masjid takbir usir djarot dari masjid,buruk laku dukung aniessandi ceramah politik masjid takbir usir djarot masjid
690,negative,Anies-Sandi,Kuota @aagym lagi abis makanya tidak mengikuti berita @Warta_MUI @mata #indonesia #pilkadaDKI #AniesSandi #voteahok #ahokdjarot,kuota abdullah gymnastiar habis ikut berita wa a majelis ulama indonesia mata indonesia pilkadadki aniessandi voteahok ahok djarot,kuota abdullah gymnastiar habis berita wa a majelis ulama indonesia mata indonesia pilkadadki aniessandi voteahok ahok djarot
691,negative,Anies-Sandi,Akun @CangHaris akun provokator & bukan bagian dari timses #AniesSandi. Timeline @CangHaris lebih mencirikan akun Ahokers. Waspadalah!,akun cangharis akun provokator tim sukses aniessandi lini masa cangharis ciri akun ahoker waspada,akun cangharis akun provokator tim sukses aniessandi lini cangharis ciri akun ahoker waspada
692,negative,Anies-Sandi,#aniessandi #bhinekatunggalika #isusara Kubu Anies-Sandi Serukan Stop Politisasi Kebhinekaan http://dlvr.it/NtcTLN,aniessandi bhinekatunggalika isusara kubu anies sandi seru stop politisasi kebinekaan,aniessandi bhinekatunggalika isusara kubu anies sandi seru stop politisasi bineka
693,negative,Anies-Sandi,#SyuhadaTPS siap Kawal !! Kami siap Mati kawal kemenangan #AniesSandi ! #AniesKalahMuslimMarah !!,syuhadatps kawal mati kawal menang aniessandi anieskalahmuslimmarah,syuhadatps kawal mati kawal menang aniessandi anieskalahmuslimmarah
694,negative,Anies-Sandi,FITNAH !!! Akun #HoaxerPanik #HoaxerKepanasan sebentar lagi #AniesSandi menang !,fitnah akun hoaxerpanik hoaxerkepanasan sebentar aniessandi menang,fitnah akun hoaxerpanik hoaxerkepanasan sebentar aniessandi menang
695,negative,Anies-Sandi,"Mobil mobil yang kena macet ke arah Mall Taman Anggrek , tempelin stiker ! Tanya sopirnya pilih #AniesSandi ato bukan !!",mobil mobil kena macet arah mal taman anggrek tempelin stiker sopir pilih aniessandi atau,mobil mobil kena macet arah mal taman anggrek tempelin stiker sopir pilih aniessandi
696,negative,Anies-Sandi,"Hari ini bhineka tunggal ika tidak akan berlaku, karena kita di hdapkan dengan pilihan yang berbeda. #aniessandi #StopPolitisasiBhinneka",bineka tunggal ika laku hdapkan pilih beda aniessandi stoppolitisasibhinneka,bineka tunggal ika laku hdapkan pilih beda aniessandi stoppolitisasibhinneka
697,negative,Anies-Sandi,Tadinya saya suka baca @okezonenews tapi  isinya terlalu memihak #AniesSandi sebaiknya media bersikap #netral betul tidak #BasukiDjarot ?,suka baca okezone news isi aniessandi media sikap netral basukidjarot,suka baca okezone news isi aniessandi media sikap netral basukidjarot
698,negative,Anies-Sandi,Bagian 1 .. Bukti Radikalis Pendukung Teroris Di Belakang @AniesBaswedan #AniesSandi #AhokDjarot #MencariPemimpin,bukti radikal dukung teroris aniesbaswedan aniessandi ahok djarot mencaripemimpin,bukti radikal dukung teroris aniesbaswedan aniessandi ahok djarot mencaripemimpin
699,negative,Anies-Sandi,"Cuma kota Jakarta, PKS di Papua malah berkoalisi dukung gubernur Kristen #AniesSandi #SandiUnoCabul",kota jaka a partai keadilan sejahtera papua koalisi dukung gubernur kristen aniessandi sandiunocabul,kota jaka a pak ai adil sejahtera papua koalisi dukung gubernur kristen aniessandi sandiunocabul
700,negative,Anies-Sandi,"tulisan @fahiraidris ini misalnya. dia mencoba membranding #aniessandi yang pluralis, tapi konseptualnya absurd banget.",tulis fahiraidris coba membranding aniessandi pluralis konseptual absurd banget,tulis fahiraidris coba membranding aniessandi pluralis konseptual absurd banget
701,negative,Anies-Sandi,Ahok menistakan agama untuk menang pilkada - Logika timses @aniesbaswedan #MataNajwaDebatJakarta #salambersama #okeoce,ahok nista agama menang pilihan kepala daerah logika tim sukses aniesbaswedan matanajwadebatjaka a salambersama oke oce,ahok nista agama menang pilih kepala daerah logika tim sukses aniesbaswedan matanajwadebatjaka a salambersama oke oke
702,negative,Anies-Sandi,"Yang lain mabuk miras sama mabok kecubung, lha aku mabuk #OKEOCE",mabuk minuman keras mabuk kecubung lah mabuk oke oce,mabuk minum keras mabuk kecubung mabuk oke oke
703,negative,Anies-Sandi,Jangan jiplak Program #OKEOCE hasil bikinan pendukung penista agama,jiplak program oke oce hasil bikin dukung nista agama,jiplak program oke oke hasil bikin dukung nista agama
704,negative,Anies-Sandi,"garansi nya global kak, refurbish, garansi bank #okeoce 3hari kalau cacat produksi boleh tukar (jadi ingin berkata kasar)",garansi nya global kak refurbish garansi bank oke oce cacat produksi tukar kasar,garansi nya global kak refurbish garansi bank oke oke cacat produksi tukar kasar
705,negative,Anies-Sandi,"Munafik, katanya tidak boleh jualan agama, tapi paling frontal bawa agama, sabar min @Gerindra yang penting #OkeOce",munafik jual agama frontal bawa agama sabar min gerindra oke oce,munafik jual agama frontal bawa agama sabar min gerindra oke oke
706,negative,Anies-Sandi,karangan bunganya buat pak ahok-djarot doang nih? buat anis-sandi mana? <grining face with smile eye>,karang bunga ahok djarot doang nih anis sandi grining face dengan smile eye,karang bunga ahok djarot doang nih anis sandi grining face smile eye
707,negative,Anies-Sandi,Apa yang dilakukan anies sandi setelah menang pilkada DKI? mungkin lagi blusukan memakai heli ke ujung kulon atau papua <grining face with smile eye>,anies sandi menang pilihan kepala daerah daerah khusus ibukota blusuk pakai helikopter ujung kulon papua grining face dengan smile eye,anies sandi menang pilih kepala daerah daerah khusus ibu kota blusuk pakai helikopter ujung kulon papua grining face smile eye
708,negative,Anies-Sandi,"Yang lucunya di Pilkada DKI adalah Ahok-Djarot yang kalah, justru mendapatkan Simpati dari Masyarakat dibandingkan kemenangan Anies-Sandi",lucu pilihan kepala daerah daerah khusus ibukota ahok djarot kalah simpati masyarakat banding menang anies sandi,lucu pilih kepala daerah daerah khusus ibu kota ahok djarot kalah simpati masyarakat banding menang anies sandi
709,negative,Anies-Sandi,"Kalo Ahok kalah, Anies-Sandi menang? Paling juga Jakarta akan seperti dulu lagi, saling rukun, koruptornya <grining face with smile eye> <grining face with smile eye> <Lying Face> <Lying Face> #PilkadaDKI",kalau ahok kalah anies sandi menang jaka a sepe i rukun koruptor grining face dengan smile eye grining face dengan smile eye lying face lying face pilkadadki,ahok kalah anies sandi menang jaka a sepe i rukun koruptor grining face smile eye grining face smile eye lying face lying face pilkadadki
710,negative,Anies-Sandi,"Berita Badja: Rencana Ahok jika menang atau kalah, Berita Anies-Sandi: hanya kecurangan besar yang bisa mengalahkn kami #pilkadaDKI",berita badja rencana ahok menang kalah berita anies sandi curang mengalahkan pilkadadki,berita badja rencana ahok menang kalah berita anies sandi curang kalah pilkadadki
711,negative,Anies-Sandi,ANIES SANDI Kalah di Debat Final Pilkada DKI https://goo.gl/eEwlma  via @KaskusTV,anies sandi kalah debat final pilihan kepala daerah daerah khusus ibukota via kaskustv,anies sandi kalah debat final pilih kepala daerah daerah khusus ibu kota via kaskustv
712,negative,Anies-Sandi,"Jadi kalo kalah, pasti badja berbuat curang? Picik <Grimacing Face>  Prabowo Sebut Anies-Sandi Akan Menang Pilkada DKI jika Tidak Dicurangi",kalau kalah badja buat curang picik grimacing face prabowo anies sandi menang pilihan kepala daerah daerah khusus ibukota curang,kalah badja curang picik grimacing face prabowo anies sandi menang pilih kepala daerah daerah khusus ibu kota curang
713,negative,Anies-Sandi,Kenapa waktu kampanye Sandi malah ke Cianjur? Anies minta dukungan Aher? Hhmm.. Jabar siap2 dilanda Anies-Sandi 2018 <Zipper-Mouth Face> Siap2 kalah Pilkada,kampanye sandi cianjur anies dukung aher hem jabar landa anies sandi zipper mouth face kalah pilihan kepala daerah,kampanye sandi cianjur anies dukung aher hem jabar landa anies sandi zipper mouth face kalah pilih kepala daerah
714,negative,Anies-Sandi,Pilkada kok panitianya banyak pakai kaos salam bersama. Mereka panitia apa tim pemenangan Anies-Sandi? Sudah main licik aja masih kalah,pilihan kepala daerah panitia pakai kaos salam panitia tim menang anies sandi main licik saja kalah,pilih kepala daerah panitia pakai kaos salam panitia tim menang anies sandi main licik kalah
715,negative,Anies-Sandi,"Setelah AHY kalah di pilkada DKI putaran 1, menuju putaran 2 ini Anies-Sandi yang bakal diserang habis-habisan oleh buzzer2 ahox.",agus harimurti yudhoyono kalah pilihan kepala daerah daerah khusus ibukota putar putar anies sandi serang habis habis buzzer ahok,agus hari i yudhoyono kalah pilih kepala daerah daerah khusus ibu kota putar putar anies sandi serang habis habis buzzer ahok
716,negative,Anies-Sandi,#Paslon3  Anies-Sandi kl kalah #pilkadaDKI pindah nyalon ke Kab. Bogor kyknya cocok nih. Bogor butuh Entrepreneurship and education,pasangan calon anies sandi kalau kalah pilkadadki pindah nyalon kabupaten bogor sepertinya cocok nih bogor butuh entrepreneurship and education,pasang calon anies sandi kalah pilkadadki pindah nyalon kabupaten bogor sepe inya cocok nih bogor butuh entrepreneurship and education
717,negative,Anies-Sandi,"Kekuatan partai2 di Jatim mei 2017, paska pilkada DKI. Perhatikan partai pendukung anies-sandi. Semua turun..",kuat pak ai jawa timur mei paska pilihan kepala daerah daerah khusus ibukota perhati pak ai dukung anies sandi turun,kuat ai jawa timur mei paska pilih kepala daerah daerah khusus ibu kota perhati ai dukung anies sandi turun
718,negative,Anies-Sandi,anies sandi menang pilkada dki #terimakasihFPI,anies sandi menang pilihan kepala daerah daerah khusus ibukota terimakasihfpi,anies sandi menang pilih kepala daerah daerah khusus ibu kota terimakasihfpi
719,negative,Anies-Sandi,"cek kaos para pendukung Anies-Sandi,kaos2 provokatif yang dipakai saat pilkada DKI dipakai dalam syukuran, dan mereka bicara rekonsiliasi",cek kaos dukung anies sandi kaos provokatif pakai pilihan kepala daerah daerah khusus ibukota pakai syukur bicara rekonsiliasi,cek kaos dukung anies sandi kaos provokatif pakai pilih kepala daerah daerah khusus ibu kota pakai syukur bicara rekonsiliasi
720,negative,Anies-Sandi,"Yang bilang Anies Sandi menang pilkada DKI karena menang di visi misi dan program mereka untuk Jakarta, boleh dong RT. <Zipper-Mouth Face>",bilang anies sandi menang pilihan kepala daerah daerah khusus ibukota menang visi misi program jaka a zipper mouth face,bilang anies sandi menang pilih kepala daerah daerah khusus ibu kota menang visi misi program jaka a zipper mouth face
721,negative,Anies-Sandi,"Paslon 3 #aniessandy curang kampanye masuk keluar masuk masjid, musolah masa seperti itu kampanye politik pilkada,tiap pengajian bagi2 duit",pasangan calon aniessandy curang kampanye masuk masuk masjid musolah sepe i kampanye politik pilihan kepala daerah aji duit,pasang calon aniessandy curang kampanye masuk masuk masjid musolah sepe i kampanye politik pilih kepala daerah aji duit
722,negative,Anies-Sandi,"DP 0% angsuran 30th itu program yang siap sengsarain cagub 5 periode berikutnya #aniessandy kabur, gubenur baru babak belur",uang muka angsur tahun program sengsarain calon gubernur periode aniessandy kabur gubernur babak bur,uang muka angsur program sengsarain calon gubernur periode aniessandy kabur gubernur babak bur
723,negative,Anies-Sandi,ditunggu konfirmasinya soal bini muda @aniesbaswedan oleh @RatnaSpaet #okeoce #salambersama #gue2 jangan ngeles ya,tunggu konfirmasi bini muda aniesbaswedan ratnaspaet oke oce salambersama gue ngeles ya,tunggu konfirmasi bini muda aniesbaswedan ratnaspaet oke oke salambersama gue ngeles ya
724,negative,Anies-Sandi,Fitnah nih Menteri Pendidikan punya binimuda? Duh KW aspal semua @SangPemburu99 @aniesbaswedan @selenakoe Anies sibuk urus istri muda,fitnah nih menteri didik binimuda aduh kw aspal sangpemburu aniesbaswedan selenakoe anies sibuk urus istri muda,fitnah nih menteri didik binimuda aduh kw aspal sangpemburu aniesbaswedan selenakoe anies sibuk urus istri muda
725,negative,Anies-Sandi,"Artis bor sumur ngebor lagi,mulai kaku itu tangannya #AnisSandi #OkeOce <OK HAND>",a is bor sumur ngebor kaku tangan anissandi oke oce oke hand,a is bor sumur ngebor kaku tangan anissandi oke oke oke hand
726,negative,Anies-Sandi,"Dan nginulpun terdiam <Face Without Mouth> . #dacademy4 Salam #OkeOce, #CoblosPecinya",nginulpun diam face tanpa mouth dacademy salam oke oce coblospecinya,nginulpun diam face mouth dacademy salam oke oke coblospecinya
727,negative,Anies-Sandi,"Wajah politik santun penuh kata mAnies bertabur wacana, dusta dan Sandiwara... #OKEOCE #salambersama #tetapahok #gue2",wajah politik santun penuh manies be abur wacana dusta sandiwara oke oce salambersama tetap ahok gue,wajah politik santun penuh manies be abur wacana dusta sandiwara oke oke salambersama ahok gue
728,negative,Anies-Sandi,"Hati2 terprovokasi ya teman. Ini bukan wajah islam, ini wajah politik. <Disappointed Face>",hati provokasi ya teman wajah islam wajah politik disappointed face,hati provokasi ya teman wajah islam wajah politik disappointed face
729,negative,Anies-Sandi,"orang kaya mah bebas, tajir melintir. Alhamdullilah. #OkeOce",orang kayak adalah bebas tajir melintir alhamdulillah oke oce,orang kayak bebas tajir melintir alhamdulillah oke oke
730,negative,Anies-Sandi,Oh ya? #OkeOce,oh ya oke oce,oh ya oke oke
731,negative,Anies-Sandi,Intelijen bayaran itu yang bermain tapi Alhamdulillah masyarakat CERDAS menanggapinya #OkeOce,intelijen bayar main alhamdulillah masyarakat cerdas tanggap oke oce,intelijen bayar main alhamdulillah masyarakat cerdas tanggap oke oke
732,negative,Anies-Sandi,"Isis juga lagi proses hukum, terus knapa komentari <grining face> <grining face> <grining face> males betengkar sama anak TK gak ber bobot, asal ngeles #OkeOce <Person Raising Hand> <Face With Stuck-Out Tongue & Closed Eyes> <Person Running> <Person Running> <Person Running>",isis proses hukum kenapa komentar grining face grining face grining face malas betengkar anak tk tidak ber bobot ngeles oke oce person raising hand face dengan stuck out tongue closed eyes person running person running person running,isis proses hukum komentar grining face grining face grining face malas betengkar anak tk ber bobot ngeles oke oke person raising hand face stuck out tongue closed eyes person running person running person running
733,negative,Anies-Sandi,#RIP Logika dan nalar @ices_ardhono #salambersama #okeoce #tetapahok #gue2 #dpNol,rip logika nalar ices ardhono salambersama oke oce tetap ahok gue dpnol,rip logika nalar ices ardhono salambersama oke oke ahok gue dpnol
734,negative,Anies-Sandi,@GunRomli vs @ahmadfuadanwar lebih seru nonton nya dari acara debat #okeoce,gunromli lawan ahmadfuadanwar seru menonton nya acara debat oke oce,gunromli lawan ahmadfuadanwar seru tonton nya acara debat oke oke
735,negative,Anies-Sandi,#debatfinalpilkadadki Hhahahaa.. #OkeOce atau OKE-NGOCEH??? @aniesbaswedan,debatfinalpilkadadki hhahahaa oke oce oke mengoceh aniesbaswedan,debatfinalpilkadadki hhahahaa oke oke oke oceh aniesbaswedan
736,negative,Anies-Sandi,Apalagi ada yang mau berpihak sama ormas abal abal #fitsahats #firzahots #okeoce #salambersama #tetapahok #kampanyeahokjahat,pihak organisasi masyarakat abal abal fitsahats firzahots oke oce salambersama tetap ahok kampanye ahok jahat,organisasi masyarakat abal abal fitsahats firzahots oke oke salambersama ahok kampanye ahok jahat
737,negative,Anies-Sandi,"Cagub kerja vs cagub wacana, cagub fakta vs cagub dusta #tetapahok #salambersama #okeoce #BeragamItuBasukiDjarot #kampanyeahokjahat",calon gubernur kerja lawan calon gubernur wacana calon gubernur fakta lawan calon gubernur dusta tetap ahok salambersama oke oce beragamitubasukidjarot kampanye ahok jahat,calon gubernur kerja lawan calon gubernur wacana calon gubernur fakta lawan calon gubernur dusta ahok salambersama oke oke beragamitubasukidjarot kampanye ahok jahat
738,negative,Anies-Sandi,@aniesbaswedan memang #pantasDipecat karena bikin masyarakat tambah bego #okeoce #salambersama #dp0 #GubernurGu3 https://twitter.com,aniesbaswedan pantasdipecat bikin masyarakat bego oke oce salambersama uang muka gubernurgu,aniesbaswedan pantasdipecat bikin masyarakat bego oke oke salambersama uang muka gubernurgu
739,negative,Anies-Sandi,"Setelah KO di beberapa Polling, kini mereka goreng soal KPUD tidak netral, kamvreetttt.... #pilkadadki2017 #debatfinalpilkadadki #OkeOce",kok polling goreng komisi pemilihan umum daerah netral kamvreetttt pilkadadki debatfinalpilkadadki oke oce,polling goreng komisi pilih daerah netral kamvreetttt pilkadadki debatfinalpilkadadki oke oke
740,negative,Anies-Sandi,#debatfinalpilkadadki ada oke oce. Ada oke mart. Lama2 ada oke jek hahaha ogah kerja ogah capek #okeoce,debatfinalpilkadadki oke oke oke sama oke jek haha ogah kerja ogah cape oke oce,debatfinalpilkadadki oke oke oke oke jek haha ogah kerja ogah cape oke oke
