Id,Sentiment,Pasangan Calon,Tweet,preprocessing,preprobaru
410,negative,Ahok-Djarot,Tidak akan diberi petunjuk orang-orang zalim. Tetap HARAM pemimpin kafir.  <Fire> <Fire> #PilkadaDKI #pilkadadki2017 #IslamRahmatanLilAlamin ,tunjuk orang orang zalim haram pimpin kafir fire fire pilkadadki pilkadadki islamrahmatanlilalamin,orang orang zalim haram pimpin kafir fire fire pilkadadki pilkadadki islamrahmatanlilalamin
411,negative,Ahok-Djarot,Jangan sampai allah mengAzab kalian wahai orang2 muslim yang memilih pemimpin kafir <High Voltage> <High Voltage> #pilkadadki2017 #PilkadaDKI,allah azab orang muslim pilih pimpin kafir high voltage high voltage pilkadadki pilkadadki,allah azab orang muslim pilih pimpin kafir high voltage high voltage pilkadadki pilkadadki
412,negative,Ahok-Djarot,Saya tidak bisa move on sampai sekarang lihatin Ahok + Djarot kalah <Slightly Frowning Face>,pindah on lihatin ahok djarot kalah slightly frowning face,pindah on lihatin ahok djarot kalah slightly frowning face
413,negative,Ahok-Djarot,Masih baper tentang Ahok-Djarot <Disappointed Face>,bawa perasaan ahok djarot disappointed face,bawa asa ahok djarot disappointed face
414,negative,Ahok-Djarot,"Bukan untuk memenangkan Anies-Sandi, tetapi untuk mengalahkan Ahok-Djarot. Tarik kesimpulannya sendiri yep",menang anies sandi kalah ahok djarot tarik simpul ya,menang anies sandi kalah ahok djarot tarik simpul ya
415,negative,Ahok-Djarot,"Sembako Murah Ala Timses Ahok-Djarot Langgar UU Pemilu http://m.viva.co.id  Suap suara model begini, menghina kecerdasan warga..",sembako murah ala tim sukses ahok djarot langgar undang undang milu suap suara model hina cerdas warga,sembako murah ala tim sukses ahok djarot langgar undang undang milu suap suara model hina cerdas warga
416,negative,Ahok-Djarot,Kok rasa2nya Ahok-Djarot bakal kalah ya.. Gerakan dan tindakan paslon 3 gencar dan mengerikan. <Face Screaming in Fear> <Face Screaming in Fear>,nya ahok djarot kalah ya gerak tindak pasangan calon gencar keri face screaming in fear face screaming in fear,nya ahok djarot kalah ya gerak tindak pasang calon gencar keri face screaming in fear face screaming in fear
417,negative,Ahok-Djarot,Itu yang ngomong jangan pilih Ahok Djarot pernah merasakan banjir tidak sih? <Pouting Face>,berbicara pilih ahok djarot rasa banjir sih pouting face,bicara pilih ahok djarot banjir sih pouting face
418,negative,Ahok-Djarot,Dulu mereka bilang #AHY cagub #FPI sekarang #Anies cagub #FPI. Intinya #Ahoker buta peta politik <Zipper-Mouth Face>,bilang agus harimurti yudhoyono calon gubernur front pembela islam anies calon gubernur front pembela islam inti ahoker buta peta politik zipper mouth face,bilang agus hari i yudhoyono calon gubernur front bela islam anies calon gubernur front bela islam inti ahoker buta peta politik zipper mouth face
419,negative,Ahok-Djarot,tolong bapak gubernur knp sampai saat kjp anak saya tidak turun juga sudah hampir 4 bulan menjelang pilkada Dki sampai sekarang <Confused Face>,tolong gubernur kenapa kjp anak turun jelang pilihan kepala daerah daerah khusus ibukota confused face,tolong gubernur kjp anak turun jelang pilih kepala daerah daerah khusus ibu kota confused face
420,negative,Ahok-Djarot,KAFIR Tetap HARAM pemimpin kafir. #PilkadaDKI #pilkadadki2017 #IslamRahmatanLilAlamin  <Fire> <Fire>  <Fire> <Fire>,kafir haram pimpin kafir pilkadadki pilkadadki islamrahmatanlilalamin fire fire fire fire,kafir haram pimpin kafir pilkadadki pilkadadki islamrahmatanlilalamin fire fire fire fire
421,negative,Ahok-Djarot,#Djarot Beberkan Kronologi Pengusiran Dirinya Setelah Sholat Jumat http://bit.ly/2pgp5M1  #AhokDjarot #PilkadaDki2017,djarot kan kronologi usir salat jumat ahok djarot pilkadadki,djarot kronologi usir salat jumat ahok djarot pilkadadki
422,negative,Ahok-Djarot,Awas serbuan warga wahabi dari bogor dan depok #JakartaberAswaja #SJPKB #pilgubDKI #JakartaPunyaSemua @kpudki https://news.detik.com,awas serbu warga wahabi bogor depok jaka aberaswaja sjpkb pilihan gubernur daerah khusus ibukota jaka apunyasemua kpudki,awas serbu warga wahabi bogor depok jaka aberaswaja sjpkb pilih gubernur daerah khusus ibu kota jaka apunyasemua kpudki
423,negative,Ahok-Djarot,"Dipecat jadi menteri ,, gimana mau jadi gubernur? #no2 #pilihAhok #AhokDjarotDiRosi #Ahok #AhokDjarot #jangansalahpilih",pecat menteri bagaimana gubernur no pilihahok ahokdjarotdirosi ahok ahok djarot jangansalahpilih,pecat menteri gubernur no pilihahok ahokdjarotdirosi ahok ahok djarot jangansalahpilih
424,negative,Ahok-Djarot,Kuota @aagym lagi habis makanya tidak mengikuti berita @Warta_MUI @mata #indonesia #pilkadaDKI #AniesSandi #voteahok #ahokdjarot,kuota abdullah gymnastiar habis ikut berita wa a majelis ulama indonesia mata indonesia pilkadadki aniessandi voteahok ahok djarot,kuota abdullah gymnastiar habis berita wa a majelis ulama indonesia mata indonesia pilkadadki aniessandi voteahok ahok djarot
425,negative,Ahok-Djarot,@bank_dki ikut2an #moneypolitic untuk kemenangan #ahokdjarot ??  <See-No-Evil Monkey>  @ojkindonesia,bank daerah khusus ibukota an moneypolitic menang ahok djarot see no evil monkey ojkindonesia,bank daerah khusus ibu kota an moneypolitic menang ahok djarot see no evil monkey ojkindonesia
426,negative,Ahok-Djarot,Kalo bete ama M Taufik boleh pilih #AhokDjarot nggak kak? Soooo PASTIIII !!! <Face With Steam From Nose> <Face With Steam From Nose> <FACE WITH TEARS OF JOY> <Smiling Face With Open Mouth & Smiling Eyes> <FACE WITH TEARS OF JOY> <grining face with smile eye> <Victory Hand> #JanganTakutPilih2 #PilihBaDja,kalau sebal sama sama taufik pilih ahok djarot enggak kak soooo pastiiii face dengan steam from nose face dengan steam from nose face dengan tears of joy smiling face dengan open mouth smiling eyes face dengan tears of joy grining face dengan smile eye victory hand jangantakutpilih pilihbadja,sebal taufik pilih ahok djarot kak soooo pastiiii face steam from nose face steam from nose face tears of joy smiling face open mouth smiling eyes face tears of joy grining face smile eye victory hand jangantakutpilih pilihbadja
427,negative,Ahok-Djarot,#AhokDjarot anti korup..kinerja kerja nyata.. Kebersihan Tata ruang kota.. Jakarta..makin baik?  <Weary Face>  <Weary Face>,ahok djarot anti korup kerja kerja nyata bersih tata ruang kota jaka a weary face weary face,ahok djarot anti korup kerja kerja nyata bersih tata ruang kota jaka a weary face weary face
428,negative,Ahok-Djarot,"Diberbagai survei, debat dimenangkan paslon no 3 nih. #Aniesbaswedan #AhokDjarot",bagai survei debat menang pasangan calon no nih aniesbaswedan ahok djarot,survei debat menang pasang calon no nih aniesbaswedan ahok djarot
429,negative,Ahok-Djarot,Memilih paslon no 3 yang pernah gagal menjalankan tugas sebelumnya adalah melecehkan akal sehat. #AhokDjarot,pilih pasangan calon no gagal jalan tugas leceh akal sehat ahok djarot,pilih pasang calon no gagal jalan tugas leceh akal sehat ahok djarot
430,negative,Ahok-Djarot,"mendadak santun & toleran gini <Zipper-Mouth Face> <Zipper-Mouth Face> <Zipper-Mouth Face> ....bukan gara"" deket tgl 19 April kan ? <FACE WITH TEARS OF JOY> <FACE WITH TEARS OF JOY> <FACE WITH TEARS OF JOY> #indonesia @Metro_TV #voteahok #ahokdjarot #ahok",dadak santun toleran begini zipper mouth face zipper mouth face zipper mouth face gara dekat tanggal april face dengan tears of joy face dengan tears of joy face dengan tears of joy indonesia metro televisi voteahok ahok djarot ahok,dadak santun toleran zipper mouth face zipper mouth face zipper mouth face gara tanggal april face tears of joy face tears of joy face tears of joy indonesia metro televisi voteahok ahok djarot ahok
431,negative,Ahok-Djarot,@aniesbaswedan kemarin bilang tidak setuju syariah . lah ini apa ?? #indonesia #badja @nu_online #ahokdjarot #pilkadaDKI @MataNajwa,aniesbaswedan kemarin bilang tuju syariat indonesia badja nu online ahok djarot pilkadadki mata najwa,aniesbaswedan kemarin bilang tuju syariat indonesia badja nu online ahok djarot pilkadadki mata najwa
432,negative,Ahok-Djarot,#TolakJakartaBersyariah #TolakJakartaBersyariah #TolakJakartaBersyariah #TolakJakartaBersyariah @LintangChrezL @Hit_DX @ChajanJr @arifinp76,tolakjaka abersyariah tolakjaka abersyariah tolakjaka abersyariah tolakjaka abersyariah lintangchrezl hit dx chajanjr arifinp,tolakjaka abersyariah tolakjaka abersyariah tolakjaka abersyariah tolakjaka abersyariah lintangchrezl hit dx chajanjr arifinp
433,negative,Ahok-Djarot,"apa yang kamu mau perangi kalau faktanya benar, yang ada pengikutmu cuma bisa caci maki saja #indonesia #bubarkanFPI #badja #ahokdjarot #mat",rang fakta ikut caci maki indonesia bubarkanfpi badja ahok djarot mat,rang fakta caci maki indonesia bubarkanfpi badja ahok djarot mat
434,negative,Ahok-Djarot,Rizieq minta pengikutnya untuk TERNAK AKUN disosmed. jadi jangan heran kalau akun twitter tiba2 diserbu PASUKAN CACI MAKI  <grining face with smile eye> <Face Screaming in Fear> <Face Screaming in Fear>,rizieq ikut ternak akun di media sosial heran akun twitter serbu pasukan caci maki grining face dengan smile eye face screaming in fear face screaming in fear,rizieq ternak akun media sosial heran akun twitter serbu pasukan caci maki grining face smile eye face screaming in fear face screaming in fear
435,negative,Ahok-Djarot,Wasekjen MUI Nilai Video Kampanye Ahok-Djarot Suduntukan Umat Islam https://goo.gl/vrIZIy  #News #AhokDjarot,wasekjen majelis ulama indonesia nilai video kampanye ahok djarot suduntukan umat islam news ahok djarot,wasekjen majelis ulama indonesia nilai video kampanye ahok djarot suduntukan umat islam news ahok djarot
436,negative,Ahok-Djarot,"Kasih Iming-iming KJL kepada Orangtua, Ahok-Djarot Diminta Jangan Menipu Lansia https://goo.gl/L2e0Wn  #News #AhokDjarot",kasih iming iming kjl orang tua ahok djarot tipu lanjut usia news ahok djarot,kasih iming iming kjl orang tua ahok djarot tipu usia news ahok djarot
437,negative,Ahok-Djarot,Tidak usah mikir coblos sebelah kiri #ahokdjarot <FACE WITH STUCK-OUT TOUNGES> <FACE WITH STUCK-OUT TOUNGES> <Victory Hand>,pikir coblos belah kiri ahok djarot face dengan stuck out tounges face dengan stuck out tounges victory hand,pikir coblos belah kiri ahok djarot face stuck out tounges face stuck out tounges victory hand
438,negative,Ahok-Djarot,Video Kampanye Ahok-Djarot Telah Hancurkan Kebhinekaan https://goo.gl/ZrUI0G  #News #AhokDjarot,video kampanye ahok djarot hancur kebinekaan news ahok djarot,video kampanye ahok djarot hancur bineka news ahok djarot
439,negative,Ahok-Djarot,SAAT ALIEN MENYERANG INDONESIA http://www.triandry.com #pertempuranakhirjawarajkt #deklarasippp #rompiskasmaran #ahokdjarot #aniessandi,alien serang indonesia pe empuranakhirjawarajkt deklarasippp rompiskasmaran ahok djarot aniessandi,alien serang indonesia pe empuranakhirjawarajkt deklarasippp rompiskasmaran ahok djarot aniessandi
440,negative,Ahok-Djarot,Lulung nyampah jadi timses anies sandi gara gara takut kena semprot ahok <FACE WITH TEARS OF JOY> #AhokDjarot <FACE WITH STUCK-OUT TOUNGES>,lulung menyampah tim sukses anies sandi gara gara takut kena semprot ahok face dengan tears of joy ahok djarot face dengan stuck out tounges,lulung sampah tim sukses anies sandi gara gara takut kena semprot ahok face tears of joy ahok djarot face stuck out tounges
441,negative,Ahok-Djarot,@KataAhok #ahok #Ahokdjarot @AhokDjarot  @TetapAhokDjarot  #3ya3 memang pilpres sabang sampai merauke? https://youtu.be lewat @YouTube,kataahok ahok ahok djarot ahok djarot tetap ahok djarot ya pemilihan presiden sabang merauke youtube,kataahok ahok ahok djarot ahok djarot ahok djarot ya pilih presiden sabang merauke youtube
442,negative,Ahok-Djarot,"Mentang mentang nama belakangnya sama, mau ambil keuntungan saja. Yang Novel iya yang Anies gak #AhokDjarot #pilgubDKI",mentang mentang nama belakang ambil untung novel iya anies tidak ahok djarot pilihan gubernur daerah khusus ibukota,mentang mentang nama ambil untung novel iya anies ahok djarot pilih gubernur daerah khusus ibu kota
443,negative,Ahok-Djarot,#AhokDjarot mencari orang pintar buanyak di Jakarta. Mencari orang yang jujur anti korupsi suka bekerja keras...itu yang sulit.,ahok djarot cari orang pintar banyak jaka a cari orang jujur anti korupsi suka keras sulit,ahok djarot cari orang pintar jaka a cari orang jujur anti korupsi suka keras sulit
444,negative,Ahok-Djarot,"Kampanyenya ngomong program ini program itu, jadi mentri aja dipecat <FACE WITH TEARS OF JOY> mending liat yang udah ada hasil kerja ada deh #AhokDjarot",kampanye berbicara program program tri saja pecat face dengan tears of joy mending lihat sudah hasil kerja deh ahok djarot,kampanye bicara program program tri pecat face tears of joy mending lihat hasil kerja deh ahok djarot
445,negative,Ahok-Djarot,"Timses anies ngomongnya sok kayak motivator, udah ahok terbaik kok jadi gubernur. Liat hasil kerjanya aja deh #AhokDjarot",tim sukses anies mengomongnya sok kayak motivator sudah ahok baik gubernur lihat hasil kerja saja deh ahok djarot,tim sukses anies omong sok kayak motivator ahok gubernur lihat hasil kerja deh ahok djarot
446,negative,Ahok-Djarot,"pantes banyak polling dihapus, kalau yang menang polling #AhokDjarot pasti DIBESAR2KAN, ditayangkan 25x dalam sehari dimetrotivi <FACE WITH TEARS OF JOY> <FACE WITH TEARS OF JOY> <FACE WITH TEARS OF JOY>",pantas polling hapus menang polling ahok djarot besar tayang x hari dimetrotivi face dengan tears of joy face dengan tears of joy face dengan tears of joy,polling hapus menang polling ahok djarot tayang x dimetrotivi face tears of joy face tears of joy face tears of joy
447,negative,Ahok-Djarot,"Buzzer #AhokDjarot galau, semua survei dan polling memenangkan #AniesSandi Invoice bakal tak dibayar nih!  <FACE WITH STUCK-OUT TOUNGES>",buzzer ahok djarot galau survei polling menang aniessandi invoice bayar nih face dengan stuck out tounges,buzzer ahok djarot galau survei polling menang aniessandi invoice bayar nih face stuck out tounges
448,negative,Ahok-Djarot,@aniesbaswedan omonganmu tidak cocok dengan fakta <Thumbs Down> <Thumbs Down>@MataNajwa @Metro_TV #pilkadaDKI #voteahok #badja  @nu_online #ahokdjarot #DKI,aniesbaswedan omong cocok fakta thumbs down thumbs down mata najwa metro televisi pilkadadki voteahok badja nu online ahok djarot daerah khusus ibukota,aniesbaswedan omong cocok fakta thumbs down thumbs down mata najwa metro televisi pilkadadki voteahok badja nu online ahok djarot daerah khusus ibu kota
449,negative,Ahok-Djarot,"#AhokDjarot unggul dalam memainkan isu dan strategi. Apalagi dalam isu sara, serta matang dalam mengelola Strategi Musuh.  <FACE WITH STUCK-OUT TOUNGES>",ahok djarot unggul main isu strategi isu sara a matang kelola strategi musuh face dengan stuck out tounges,ahok djarot unggul main isu strategi isu sara a matang kelola strategi musuh face stuck out tounges
450,negative,Ahok-Djarot,nasi bungkus terdeteksi #ahokdjarot,nasi bungkus deteksi ahok djarot,nasi bungkus deteksi ahok djarot
451,positive,Ahok-Djarot,PDI-P perkuat kemenangan Ahok-Djarot #pilkadaDKI2017.,partai demokrasi indonesia p kuat menang ahok djarot pilkadadki,pak ai demokrasi indonesia p kuat menang ahok djarot pilkadadki
452,positive,Ahok-Djarot,Inilah pemenang #PilkadaDKI2017 yang sesungguhnya. Mereka harus mengalah agar Jakarta tidak pecah oleh politik sara yang brutal dari pihak,menang pilkadadki sungguh kalah jaka a pecah politik sara brutal,menang pilkadadki sungguh kalah jaka a pecah politik sara brutal
453,positive,Ahok-Djarot,Hujan Sembako dari Ahok-Djarot Jadi Sedekah bagi Anies-Sandi #PilkadaDKI2017,hujan sembako ahok djarot sedekah anies sandi pilkadadki,hujan sembako ahok djarot sedekah anies sandi pilkadadki
454,positive,Ahok-Djarot,"Dalam hitungan saya, pemenang sesungguhnya dalam #PilkadaDKI2017 adalah #AhokDjarot, tapi mereka harus mengalah untuk kepentingan nasional.",hitung menang sungguh pilkadadki ahok djarot kalah penting nasional,hitung menang sungguh pilkadadki ahok djarot kalah nasional
455,positive,Ahok-Djarot,terima kasih pak ahok  @basuki_btp #pilkadadki2017,terima kasih ahok basuki ahok pilkadadki,terima kasih ahok basuki ahok pilkadadki
456,positive,Ahok-Djarot,"Sempat terkejut karena Bapak Ahok kalah dalam versi Quick Count #pilkadadki2017. Tidak apa-apa, tetep keren terus ya pak! Tetap menginspiras",kejut ahok kalah versi quick count pilkadadki tetap keren ya menginspiras,kejut ahok kalah versi quick count pilkadadki keren ya menginspiras
457,positive,Ahok-Djarot,"Jadi serahkan semua takdir kehidupan kepada Tuhan, kita hanya menjalankan sebaik mungkin. Bukan begitu pak @basuki_btp #pilkadadki2017",serah takdir hidup tuhan jalan basuki ahok pilkadadki,serah takdir hidup tuhan jalan basuki ahok pilkadadki
458,positive,Ahok-Djarot,Trimakasih pak @basuki_btp atas kinerja bapak degan pak djarot dalam memimpin dki. #pilkadadki2017,terima kasih basuki ahok kerja degan djarot pimpin daerah khusus ibukota pilkadadki,terima kasih basuki ahok kerja degan djarot pimpin daerah khusus ibu kota pilkadadki
459,positive,Ahok-Djarot,"Melihat para @temanAhok, harapan itu kembali hidup. Mereka akan jadi ahok masa depan. Menyelamatkan NKRI dari tikus berdasi. #pilkadadki2017",temanahok harap hidup ahok selamat negara kesatuan republik indonesia tikus das pilkadadki,temanahok harap hidup ahok selamat negara satu republik indonesia tikus das pilkadadki
460,positive,Ahok-Djarot,Selamat istirahat pak @basuki_btp Setelah ronde panjang melawan penjahat Anda telah menang #pilkadajakarta #pilkadadki2017 #BasukiDjarot,selamat istirahat basuki ahok ronde lawan jahat menang pilkadajaka a pilkadadki basukidjarot,selamat istirahat basuki ahok ronde lawan jahat menang pilkadajaka a pilkadadki basukidjarot
461,positive,Ahok-Djarot,Kekuasaan itu Tuhan yang kasih Tuhan juga yang ambil. #TerimakasihPakAhok saya bangga memilih Pak Ahok #pilkadadki2017 #TerimaKasihAhok,kuasa tuhan kasih tuhan ambil terimakasihpakahok bangga pilih ahok pilkadadki terimakasihahok,kuasa tuhan kasih tuhan ambil terimakasihpakahok bangga pilih ahok pilkadadki terimakasihahok
462,positive,Ahok-Djarot,"Yang 1 itu selama kerja sudah terbukti, yang diomongin jadi kenyataan. Yang 1 nya jadi menteri aja dipecat apalagi ini? #pilkadadki2017",kerja bukti diomongi nyata nya menteri saja pecat pilkadadki,kerja bukti omong nyata nya menteri pecat pilkadadki
463,positive,Ahok-Djarot,"Tidak apa-apa Ahok kalah, supaya sedikit aman. Coba Ahok menang, calo akhirat pada ribet teriak-teriak di monas. #PilkadaDKI #pilkadadki2017",ahok kalah aman coba ahok menang calo akhirat ribet teriak teriak monas pilkadadki pilkadadki,ahok kalah aman coba ahok menang calo akhirat ribet teriak teriak monas pilkadadki pilkadadki
464,positive,Ahok-Djarot,Untuk bpk@basuki_btp terima kasih untuk perjuanganmu selama 5 tahun terakhir. Kami akan terus mendukungmu terbang lebih tinggi lagi.#pilkada,bapak basuki ahok terima kasih juang dukung terbang pilihan kepala daerah,basuki ahok terima kasih juang dukung terbang pilih kepala daerah
465,positive,Ahok-Djarot,Artis pendukung Ahok selamati rekannya pendukung Anies http://ow.ly/XvnN30aYrAS  #PilkadaDKI2017,a is dukung ahok selamat rekan dukung anies pilkadadki,a is dukung ahok selamat rekan dukung anies pilkadadki
466,positive,Ahok-Djarot,"Saatnya menerima gubernur baru. Terima kasih kepada gubernur lama. Sudahi perselisihan, mari bersatu untuk maju.#pilkadadki2017",terima gubernur terima kasih gubernur sudah selisih mari satu maju pilkadadki,terima gubernur terima kasih gubernur selisih mari maju pilkadadki
467,positive,Ahok-Djarot,Kepemimpinan bapak @ahok membuat saya bangga menjadi bagian dari pegawai pemerintah.Terimakasih pak @ahok #salam2Jari,pimpin ahok bangga pegawai perintah terima kasih ahok salam jari,pimpin ahok bangga pegawai perintah terima kasih ahok salam jari
468,positive,Ahok-Djarot,@ahok @djarot saya mendukungmu di pilkada ini dengan sepenuh hati. Semoga menang menang merdeka,ahok djarot dukung pilihan kepala daerah sepenuh hati semoga menang menang merdeka,ahok djarot dukung pilih kepala daerah sepenuh hati semoga menang menang merdeka
469,positive,Ahok-Djarot,#pilkadadki2017 sangat mencintaimu pak @ahok. Menanglah dan lanjutkan,pilkadadki cinta ahok menang lanjut,pilkadadki cinta ahok menang
470,positive,Ahok-Djarot,#HasilC10 #Ba2ukiDjarot #pilkadadki2017 #MataRakyat #KawalPilkada @basuki_btp @AhokDjarot unggul di TPS 58 Duri Kosambi Cengkareng,hasilc ba ukidjarot pilkadadki matarakyat kawalpilkada basuki ahok ahok djarot unggul tempat pemungutan suara duri kosambi cengkareng,hasilc ba ukidjarot pilkadadki matarakyat kawalpilkada basuki ahok ahok djarot unggul mungut suara duri kosambi cengkareng
471,positive,Ahok-Djarot,"Warga Pluit : Kami Pilih Ahok Karena Kerjanya, Bukan Satu Etnis. https://goo.gl/KVN4o5  #pilkadadki2017 #wargapluit @basuki_btp",warga pluit pilih ahok kerja etnis pilkadadki wargapluit basuki ahok,warga pluit pilih ahok kerja etnis pilkadadki wargapluit basuki ahok
472,positive,Ahok-Djarot,Selesai untuk beberapa waktu. Kami tetap setia #pilkadadki2017 https://www.instagram.com/p/BTDXsnuDpP9/,selesai setia pilkadadki,selesai setia pilkadadki
473,positive,Ahok-Djarot,Usai Nyoblos Ahok Hanya Tersenyum. https://goo.gl/Ea1PNS  #pilkadadki2017 #ahok,mencoblos ahok senyum pilkadadki ahok,coblos ahok senyum pilkadadki ahok
474,positive,Ahok-Djarot,"Warga bekasi-tangerang-bogor-depok dihimbau agar mencoblos No.3,jangan (((No.2))) Dan bagi SEMUA warga DKI coblos (((No.2))) #PilkadaDki2017",warga bekas tangerang bogor depok dihimbau coblos no no warga daerah khusus ibukota coblos no pilkadadki,warga bekas tangerang bogor depok dihimbau coblos no no warga daerah khusus ibu kota coblos no pilkadadki
475,positive,Ahok-Djarot,Selamat Pagi Salam 2 Jari untuk #pilkadadki2017 #pilkadajakarta,selamat pagi salam jari pilkadadki pilkadajaka a,selamat pagi salam jari pilkadadki pilkadajaka a
476,positive,Ahok-Djarot,"Mari kita berdoa, agar mereka semua dengan hati yang bersih coblos paslon no 2 . Berdoa dimulai... #pilkadadki2017",mari doa hati bersih coblos pasangan calon no doa pilkadadki,mari doa hati bersih coblos pasang calon no doa pilkadadki
477,positive,Ahok-Djarot,"Meski Saya warga Sultra, tetapi Saya dukung Ahok Djarot Untuk Gub.DKI Jakarta #pilkadadki2017 #pilkadajakarta #ahokmenang #ahok",warga sultra dukung ahok djarot gubernur daerah khusus ibukota jaka a pilkadadki pilkadajaka a ahokmenang ahok,warga sultra dukung ahok djarot gubernur daerah khusus ibu kota jaka a pilkadadki pilkadajaka a ahokmenang ahok
478,positive,Ahok-Djarot,"Apa yang dicari.? Pilih gubernur, yang bisa mimpin jakarta. Bukan yang hanya omong kosong #BesokGuaAhok #pilkadadki2017 #PastikanBesokDua",cari pilih gubernur memimpin jaka a omong kosong besokguaahok pilkadadki pastikanbesokdua,cari pilih gubernur pimpin jaka a omong kosong besokguaahok pilkadadki pastikanbesokdua
479,positive,Ahok-Djarot,satu orang pemimpin yang tahu bagaimana cara memimpin adalah lebih baik dari pada seribu orang yang belajar kepemimpinan #pilkadadki2017,orang pimpin pimpin ribu orang ajar pimpin pilkadadki,orang pimpin pimpin ribu orang ajar pimpin pilkadadki
480,positive,Ahok-Djarot,#PilkadaDKI2017 KH Said Aqil Sebut #Ahok-Djarot Sejalan dengan NU,pilkadadki kh said aqil ahok djarot jalan nu,pilkadadki kh said aqil ahok djarot jalan nu
481,positive,Ahok-Djarot,Kita Butuh Pemimpin BERMUTU Bukan Sebatas penjaja KARTU di #pilkadadki2017 Nanti Semoga @AhokDjarot Sukses dan menang,butuh pimpin mutu batas jaja kakak kamu pilkadadki semoga ahok djarot sukses menang,butuh pimpin mutu batas jaja kakak pilkadadki semoga ahok djarot sukses menang
482,positive,Ahok-Djarot,3 hari lagi menuju #pilkadadki2017 .dari provinsi jambi aku turut mengAMINkan tuit ini moga pak purnama @basuki_btp Dan pak hidayat terpilih,pilkadadki provinsi jambi amin tuit semoga purnama basuki ahok hidayat pilih,pilkadadki provinsi jambi amin tuit semoga purnama basuki ahok hidayat pilih
483,positive,Ahok-Djarot,Iwan Fals saja pilih Ahok Djarot..tahu kan konsistennya Iwan Fals melawan korupsi ? #pilkadadki2017 @Takviri,iwan fals pilih ahok djarot konsisten iwan fals lawan korupsi pilkadadki takviri,iwan fals pilih ahok djarot konsisten iwan fals lawan korupsi pilkadadki takviri
484,positive,Ahok-Djarot,Tanggal 19 pilih dengan hati nurani ya #pilkadadki2017 #BaDjaUntukJakarta,tanggal pilih hati nurani ya pilkadadki badjauntukjaka a,tanggal pilih hati nurani ya pilkadadki badjauntukjaka a
485,positive,Ahok-Djarot,#1000Lilin #rizieqpulang #LilinUntukAhok #ahok #AhokDjarot andai saja ini bisa di contoh untuk seluruh indonesia,lilin rizieqpulang lilinuntukahok ahok ahok djarot andai contoh indonesia,lilin rizieqpulang lilinuntukahok ahok ahok djarot andai contoh indonesia
486,positive,Ahok-Djarot,Bener banget! Cuma yang nonton concert Coldplay aja yang ngerti #AhokDjarot,benar banget menonton conce coldplay saja nge i ahok djarot,banget tonton conce coldplay nge i ahok djarot
487,positive,Ahok-Djarot,"Pelajaran Kesabaran dari ""The Invisible"" Djarot http://kom.ps/AFwLJ5  #AhokSelaluDihati #badja #AhokDjarot #AhokMartir",ajar sabar the invisible djarot ahokselaludihati badja ahok djarot ahokma insinyur,ajar sabar the invisible djarot ahokselaludihati badja ahok djarot ahokma insinyur
488,positive,Ahok-Djarot,Apa pendapat anda tentang pak ahok? â€” Pemimpin hebat yang Tuhan utus utk Indonesia #gueahok #ahokdjarot #saveahok http://l.ask.fm/igoto,dapat ahok pimpin hebat tuhan utus untuk indonesia gueahok ahok djarot save ahok,ahok pimpin hebat tuhan utus indonesia gueahok ahok djarot save ahok
