Id,Sentiment,Pasangan Calon,Tweet,preprocessing,preprobaru
1,negative,Agus-Sylvi,Banyak akun kloning seolah2 pendukung #agussilvy mulai menyerang paslon #aniessandi dengan opini dan argumen pmbenaran..jangan terkecoh,akun kloning dukung agussilvy serang pasangan calon aniessandi opini argumen pmbenaran kecoh,akun kloning dukung agussilvy serang pasang calon aniessandi opini argumen pmbenaran kecoh
2,negative,Agus-Sylvi,#agussilvy bicara apa kasihan yaa...lap itu air matanya wkwkwkwk,agussilvy bicara kasihan ya lap air mata wkwk,agussilvy bicara kasihan ya lap air mata wkwk
3,negative,Agus-Sylvi,Kalau aku sih gak nunggu hasil akhir QC tp lagi nunggu motif cuitan pak @SBYudhoyono kayak apa.. pasca #AgusSilvy Nyungsep..,sih tidak menunggu hasil qc tetapi menunggu motif cuit susilo bambang yudhoyono kayak pasca agussilvy nyungsep,sih tunggu hasil qc tunggu motif cuit susilo bambang yudhoyono kayak pasca agussilvy nyungsep
4,negative,Agus-Sylvi,Kasian oh kasian dengan peluru 1milyar untuk tiap RW #agussilvy tidak mempan menangin pilkada #QuickCount #PilkadaSerentak2017,kasih oh kasih peluru milyar rukun warga agussilvy mempan memenangkan pilihan kepala daerah quickcount pilkadaserentak,kasih oh kasih peluru milyar rukun warga agussilvy mempan menang pilih kepala daerah quickcount pilkadaserentak
5,negative,Agus-Sylvi,Maaf ya pendukung #AgusSilvy..hayo dukung #AniesSandi diputaran 2 @ronavioleta @NetizenTofa,maaf ya dukung agussilvy hayo dukung aniessandi putar ronavioleta netizentofa,maaf ya dukung agussilvy hayo dukung aniessandi putar ronavioleta netizentofa
6,negative,Agus-Sylvi,"aneh deh lebay masa ini di sangkut pautkan sama kandidat Calgub, anda lebay seperti yg anda dukung #agussilvy",aneh deh lebay sangkut paut kandidat calgub lebay sepe i yang dukung agussilvy,aneh deh lebay sangkut paut kandidat calgub lebay sepe i dukung agussilvy
7,negative,Agus-Sylvi,Kepada Allah SWT kami ucapkan rasa syukur dan kepada pak @SBYudhoyono @presidenSBY #AHY kami sampaikan terimakasih. Makna 17% suara anda.,allah subhanahu wa taala ucap syukur susilo bambang yudhoyono presidensby agus harimurti yudhoyono terima kasih makna suara,allah subhanahu wa taala syukur susilo bambang yudhoyono presidensby agus hari i yudhoyono terima kasih makna suara
8,negative,Agus-Sylvi,Terima Kasih teruntuk pendukung #AHY #SYLVI kalianlah pembeda kali ini,terima kasih untuk dukung agus harimurti yudhoyono sylvi kalian beda kali,terima kasih dukung agus hari i yudhoyono sylvi beda kali
9,negative,Agus-Sylvi,Trima Kasih atas KeIstiqomahan Relawan #AHY @AgusYudhoyono lah yg tlh mengantarkan #AniesSandiDKI1 #JakartaGubernurBaru dg cukup signifikan,terima kasih keistiqomahan rawan agus harimurti yudhoyono agusyudhoyono yang telah antar aniessandidki jaka agubernurbaru dengan signifikan,terima kasih keistiqomahan rawan agus hari i yudhoyono agusyudhoyono aniessandidki jaka agubernurbaru signifikan
10,negative,Agus-Sylvi,Mengenang pidato kekalahan #ahy,kenang pidato kalah agus harimurti yudhoyono,kenang pidato kalah agus hari i yudhoyono
11,negative,Agus-Sylvi,"dammnn,!! politik cantik #SBY ngorbanin #AHY",dammnn politik cantik susilo bambang yudhoyono mengorbankan agus harimurti yudhoyono,dammnn politik cantik susilo bambang yudhoyono korban agus hari i yudhoyono
12,negative,Agus-Sylvi,"Batal nyoblos, baru tau ternyata ga ada no.1 di kertas suara. #AHY #kangen #mosing	",batal mencoblos tau tidak no as suara agus harimurti yudhoyono kangen mosing,batal coblos tau no as suara agus hari i yudhoyono kangen mosing
13,negative,Agus-Sylvi,sudah boleh Ngakak? survey mu jauh panggang dari api ! #Ahy,tertawa survei mu panggang api agus harimurti yudhoyono,te awa survei mu panggang api agus hari i yudhoyono
14,negative,Agus-Sylvi,aku juga kemarin #AHY 19april2017 suaraku utk paslon 3 #DKI,kemarin agus harimurti yudhoyono april suara untuk pasangan calon daerah khusus ibukota,kemarin agus hari i yudhoyono april suara pasang calon daerah khusus ibu kota
15,negative,Agus-Sylvi,Karna yang belebihan itu tidak baik ya bah #AHY,karena belebihan ya bah agus harimurti yudhoyono,belebihan ya bah agus hari i yudhoyono
16,negative,Agus-Sylvi,"om AA kemana ? lepas #AHY kalah kok dia tutup mulut tidak koar"" mau bongkar SBY",om kakak mana lepas agus harimurti yudhoyono kalah tutup mulut koar bongkar susilo bambang yudhoyono,om kakak lepas agus hari i yudhoyono kalah tutup mulut koar bongkar susilo bambang yudhoyono
17,negative,Agus-Sylvi,kalau pencatutan nama #ahy dan mpo #silvi melanggar hukum ga ya.. wkwkwkwkkwkk,catut nama agus harimurti yudhoyono empok silvy langgar hukum tidak ya wkwkwkwkkwkk,catut nama agus hari i yudhoyono empok silvy langgar hukum ya wkwkwkwkkwkk
18,negative,Agus-Sylvi,ya pastilah #FPI kan ga suka ama Ahok jd pas #AHY udah kalah otomatis dukungannya lari ke mas #Anisa AniesSandi,ya front pembela islam tidak suka sama ahok jadi pas agus harimurti yudhoyono sudah kalah otomatis dukung lari mas anisa aniessandi,ya front bela islam suka ahok pas agus hari i yudhoyono kalah otomatis dukung lari mas anisa aniessandi
19,negative,Agus-Sylvi,dia lah Banteng.. dia lah Garuda!! ksatria seperti bpk @prabowo gentle spt #AHY @AgusYudhoyono ..jadi cinta sama #HajiDjarot,banteng garuda ksatria sepe i bapak prabowo gentle surat pemberitahuan tahunan agus harimurti yudhoyono agusyudhoyono cinta hajidjarot,banteng garuda ksatria sepe i prabowo gentle surat pemberitahuan tahun agus hari i yudhoyono agusyudhoyono cinta hajidjarot
20,negative,Agus-Sylvi,"Gara2 e-KTP dikorupsi, fotoku yg semula mirip #AHY, pelan tapi pasti skrang malah mirip - Stickmoticons”",gara e kartu tanda penduduk korupsi foto yang agus harimurti yudhoyono pelan sekarang stickmoticons,gara e kakak kamu tanda duduk korupsi foto agus hari i yudhoyono pelan stickmoticons
21,negative,Agus-Sylvi,"Double LOL. @aniesbaswedan nuduh @AgusYudhoyono miskin ide, sekarang dia copy #AHY. @SBYudhoyono http://m.republika.co.id",double wkwk aniesbaswedan menuduh agusyudhoyono miskin ide copy agus harimurti yudhoyono susilo bambang yudhoyono,double wkwk aniesbaswedan tuduh agusyudhoyono miskin ide copy agus hari i yudhoyono susilo bambang yudhoyono
22,negative,Agus-Sylvi,Kemana nih Antasari. .. #ahy kalah di #pilgubdki2017 melempem dia... bener-bener akting yang https://www.instagram.com/p/BRXaBMtBUeb/,mana nih antasari agus harimurti yudhoyono kalah pilihan gubernur daerah khusus ibukota melempem benar benar akting,nih antasari agus hari i yudhoyono kalah pilih gubernur daerah khusus ibu kota melempem akting
23,negative,Agus-Sylvi,Ingat! Tidak bisa modal OMONGAN saja. Tapi kerja nyata! #agusharimurtiyudhoyono #AHYâ€¦ https://www.instagram.com/p/BROjg0gBpYa/,modal omong kerja nyata agusharimu iyudhoyono agus harimurti yudhoyono,modal omong kerja nyata agusharimu iyudhoyono agus hari i yudhoyono
24,negative,Agus-Sylvi,"#ahy, pakdhe karwo, Pilgub Jatim, Pak Dhe Karwo Isyaratkan Agus Tidak Akan Maju di Pilgub Jatim",agus harimurti yudhoyono pakde karwo pilihan gubernur jawa timur deh karwo isyarat agus maju pilihan gubernur jawa timur,agus hari i yudhoyono pakde karwo pilih gubernur jawa timur deh karwo isyarat agus maju pilih gubernur jawa timur
25,negative,Agus-Sylvi,"Paslon salah langkah seperti dilakukan Sandi ini, bukan tidak mungkin jadi bumerang gagal dapat suara #AHY. @ZaraZettiraZZ @monethamrin",pasangan calon salah langkah sepe i sandi bumerang gagal suara agus harimurti yudhoyono zarazettirazz monethamrin,pasang calon salah langkah sepe i sandi bumerang gagal suara agus hari i yudhoyono zarazettirazz monethamrin
26,negative,Agus-Sylvi,"Jangan2, relawan inilah yang gembosi #AHY lalu.",rawan gembos agus harimurti yudhoyono,rawan gembos agus hari i yudhoyono
27,negative,Agus-Sylvi,"Di manakah #AHY... Sang Ksatria, Samurai, Prajurit, Pembangun semangat & harapan, Pahlawan yg dinanti-nantikan rakyat itu...",mana agus harimurti yudhoyono sang ksatria samurai prajurit bangun semangat harap pahlawan yang nanti nanti rakyat,agus hari i yudhoyono sang ksatria samurai prajurit bangun semangat harap pahlawan rakyat
28,negative,Agus-Sylvi,"Kini, ketika #AHY berada di luar arena, tabir kegelapan & tiada harapan kembali menyergap rakyat. Kemana lagi rakyat mencari ketulusan?",agus harimurti yudhoyono arena tabir gelap tiada harap sergap rakyat mana rakyat cari tulus,agus hari i yudhoyono arena tabir gelap tiada harap sergap rakyat rakyat cari tulus
29,negative,Agus-Sylvi,"@AdjieRimbawan isu lama diangkat lagi, video lama dishare lagi, padahal video sudah disebar buzzer #AHY eh jelang #putaranke2 disebar lagi",adjierimbawan isu angkat video disebarkan video sebar buzzer agus harimurti yudhoyono eh jelang putaranke sebar,adjierimbawan isu angkat video sebar video sebar buzzer agus hari i yudhoyono eh jelang putaranke sebar
30,negative,Agus-Sylvi,Baru tau Bu Carik @luviku tidak coblos #AHY kemarin. Piss,tau bu carik luviku coblos agus harimurti yudhoyono kemarin piss,tau bu carik luviku coblos agus hari i yudhoyono kemarin piss
31,negative,Agus-Sylvi,"Awas ye kalo minta dukungan suara pendukung #AHY	",awas iya kalau dukung suara dukung agus harimurti yudhoyono,awas iya dukung suara dukung agus hari i yudhoyono
32,negative,Agus-Sylvi,Ini Dia Pelaku Pengirim SMS Gelap Antasari Azhar #Indonesia #SBY #AHY #Anies #Ahok #Berita #JumatBerkah #Rizieq,laku kirim sms gelap antasari azhar indonesia susilo bambang yudhoyono agus harimurti yudhoyono anies ahok berita jumat berkah rizieq,laku kirim sms gelap antasari azhar indonesia susilo bambang yudhoyono agus hari i yudhoyono anies ahok berita jumat berkah rizieq
33,negative,Agus-Sylvi,Antasari Diancam Harry Tanoe https://youtu.be/9KbbpAjibTc  #Antasari #ahok #Sby #AHY #berita #MetroTV #Indonesia #JumatBerkah #KimJongNam,antasari ancam harry tanoe antasari ahok susilo bambang yudhoyono agus harimurti yudhoyono berita metrotv indonesia jumat berkah kimjongnam,antasari ancam harry tanoe antasari ahok susilo bambang yudhoyono agus hari i yudhoyono berita metrotv indonesia jumat berkah kimjongnam
34,negative,Agus-Sylvi,"Tuduhan terhadap #AHY yg kerap dilontarkan: anak ingusan dan cuma mayor, sekarang tak terdengar lagi. Dudah berubah menjadi sanjungan!?",tuduh agus harimurti yudhoyono yang kerap lontar anak ingus mayor dengar dudah ubah sanjung,tuduh agus hari i yudhoyono kerap lontar anak ingus mayor dengar dudah ubah sanjung
35,negative,Agus-Sylvi,JOKE terbaik selama pilkada serentak 2017 #bravo @masril_pku @Chilli_Pari #AHY.,joke baik pilihan kepala daerah serentak bravo masril pku chilli pari agus harimurti yudhoyono,joke pilih kepala daerah serentak bravo masril pku chilli pari agus hari i yudhoyono
36,negative,Agus-Sylvi,Jangan curiga dulu saldonya bisa di kenti seperti BLT orang mau berbuat baik belum apa2 sudah curiga mekanismenya seperti apa #AHY,curiga saldo kenti sepe i bantuan langsung tunai orang buat curiga mekanisme sepe i agus harimurti yudhoyono,curiga saldo kenti sepe i bantu langsung tunai orang curiga mekanisme sepe i agus hari i yudhoyono
37,negative,Agus-Sylvi,ahoker masih bully #AHY,ahoker bully agus harimurti yudhoyono,ahoker bully agus hari i yudhoyono
38,negative,Agus-Sylvi,Sayang mayor #AHY termasuk yang dikader untuk pemimpin masa depan Dari SMA taruna beliau selalu yang teratas Lagi2 itu pilihan #pensiundini,sayang mayor agus harimurti yudhoyono kader pimpin sama taruna beliau atas pilih pensiundini,sayang mayor agus hari i yudhoyono kader pimpin taruna beliau pilih pensiundini
39,negative,Agus-Sylvi,setuju bangett.. banyak yang tidak bersyukur kemrin tidak banjir sekarang malah sibuk mencari pembelaan #jangan_sombong #AHY #banjirjkt,tuju banget syukur kemrin banjir sibuk cari bela sombong agus harimurti yudhoyono banjirjkt,tuju banget syukur kemrin banjir sibuk cari bela sombong agus hari i yudhoyono banjirjkt
40,negative,Agus-Sylvi,pakai sedotan atau sodetan versi #AHY,pakai sedot sodet versi agus harimurti yudhoyono,pakai sedot sodet versi agus hari i yudhoyono
41,negative,Agus-Sylvi,Hellloooo.... Suara rakyat.. Ngerti suara rakyat? Bukan suaranya #AHY or dek @AgusYudhoyono.. Ngopi dulu gih.. #PenikmatKopi,hellloooo suara rakyat nge i suara rakyat suara agus harimurti yudhoyono orang dek agusyudhoyono minum kopi gih penikmatkopi,hellloooo suara rakyat nge i suara rakyat suara agus hari i yudhoyono orang dek agusyudhoyono minum kopi gih penikmatkopi
42,negative,Agus-Sylvi,Cari teman kok cara gitu ya.. pdhal #AHY sdh jelas. Gubernur Baru...@MasTBP,cari teman begitu ya padahal agus harimurti yudhoyono sudah gubernur mastbp,cari teman ya agus hari i yudhoyono gubernur mastbp
43,negative,Agus-Sylvi,"secara kesatria dan lapang dada ternyata hoax, yang ada hanya kalah ya sudah masih menang banyak ulama bayaran #ahy",kesatria lapang dada hoaks kalah ya menang ulama bayar agus harimurti yudhoyono,kesatria lapang dada hoaks kalah ya menang ulama bayar agus hari i yudhoyono
44,negative,Agus-Sylvi,"Agus tersingkir, Ahok & Anies rebutan suara AHY untuk kepentingan kelompok   lewat @YouTube #ahok #anies #ahy #pilgub",agus singkir ahok anies rebut suara agus harimurti yudhoyono penting kelompok youtube ahok anies agus harimurti yudhoyono pilihan gubernur,agus singkir ahok anies rebut suara agus hari i yudhoyono kelompok youtube ahok anies agus hari i yudhoyono pilih gubernur
45,negative,Agus-Sylvi,Meskipun #AHY kehilangan kesempatan untuk menduduki Gubernur DKI 2017-2022,agus harimurti yudhoyono hilang sempat duduk gubernur daerah khusus ibukota,agus hari i yudhoyono hilang duduk gubernur daerah khusus ibu kota
46,negative,Agus-Sylvi,Banyak konstituen #AHY risih sama mulutnya Ahok tapi kalau diminta pilih Anies dengan gerombolan khilafah dibelakangnya lebih memilih Ahok,konstituen agus harimurti yudhoyono risih mulut ahok pilih anies gerombol khilafah belakang pilih ahok,konstituen agus hari i yudhoyono risih mulut ahok pilih anies gerombol khilafah pilih ahok
47,negative,Agus-Sylvi,Cari teman ni yee.1dan3 punya keinginan sama Gubernur Baru...tunggu dlu hasil resmi KPU baru dengar pernyataan #AHY,cari teman nih iya gubernur tunggu dulu hasil resmi komisi pemelihan umum dengar nyata agus harimurti yudhoyono,cari teman nih iya gubernur tunggu hasil resmi komisi pemelihan dengar nyata agus hari i yudhoyono
48,negative,Agus-Sylvi,blunder itu ya dulu hina2 #AHY tapi sekarang butuh 17% suara dan harus ngemis minta sama orang yang dulu di hina2. JLEB!,blunder ya hina agus harimurti yudhoyono butuh suara mengemis orang hina jleb,blunder ya hina agus hari i yudhoyono butuh suara emis orang hina jleb
49,negative,Agus-Sylvi,Masih mau mencaci maki #AHY dan Pepo Memo nya?! Kalian hrs mengemis minta suara 17% kpd orang2 yang selama ini kalian hina!!!!!!,caci maki agus harimurti yudhoyono pepo memo nya harus emis suara kepada orang hina,caci maki agus hari i yudhoyono pepo memo nya emis suara orang hina
50,negative,Agus-Sylvi,Golput lebih tinggi daripada pemilih #AHY ya nampaknya. #pilkadadki2017,golput pilih agus harimurti yudhoyono ya nampaknya pilkadadki,golput pilih agus hari i yudhoyono ya nampaknya pilkadadki
51,negative,Agus-Sylvi,Kalau merhatiin relawan #AHY saat ini minta rehat itu karena ada hal yang ganjal mungkin harus ada Islah dengan relawan #AniesSandi dulu.,memperhatikan rawan agus harimurti yudhoyono rehat ganjal islah rawan aniessandi,perhati rawan agus hari i yudhoyono rehat ganjal islah rawan aniessandi
52,negative,Agus-Sylvi,"#AHY, pakar mantan, sby, Ini Surat Anas Urbaningrum Dari Jeruji Besi, Sindiran Buat Mantan?",agus harimurti yudhoyono pakar mantan susilo bambang yudhoyono surat anas urbaningrum jeruji besi sindir mantan,agus hari i yudhoyono pakar mantan susilo bambang yudhoyono surat anas urbaningrum jeruji besi sindir mantan
53,negative,Agus-Sylvi,Jangan tanya aku. aku sekeluarga pemilih #AHY. Kalau program DP 0% nyata. aku sekeluarga milih #3. https://twitter.com/totonih/status/,keluarga pilih agus harimurti yudhoyono program uang muka nyata keluarga memilih,keluarga pilih agus hari i yudhoyono program uang muka nyata keluarga pilih
54,negative,Agus-Sylvi,"#AHY-Sylvi, Anies-Sandiaga, Basuki-Djarot, Debat Pilkada DKI 2017, Jangan Jual Mimpi Demi Jadi Gubernur...",agus harimurti yudhoyono sylvi anies sandiaga basuki djarot debat pilihan kepala daerah daerah khusus ibukota jual mimpi gubernur,agus hari i yudhoyono sylvi anies sandiaga basuki djarot debat pilih kepala daerah daerah khusus ibu kota jual mimpi gubernur
55,negative,Agus-Sylvi,ahhhh bukannya karena bang aji ada disitu yang bikin kalah #AHY?,ah bang aji situ bikin kalah agus harimurti yudhoyono,ah bang aji situ bikin kalah agus hari i yudhoyono
56,negative,Agus-Sylvi,"Mungkin saya, dengan rendah hati, bisa meminta pendukung paslon 1 yang masih berat hati, untuk melihat foto ini sejenak #AHY",rendah hati dukung pasangan calon berat hati foto agus harimurti yudhoyono,rendah hati dukung pasang calon berat hati foto agus hari i yudhoyono
57,negative,Agus-Sylvi,Aku bangga jadi anak memo. #AHY #moshing,bangga anak memo agus harimurti yudhoyono moshing,bangga anak memo agus hari i yudhoyono moshing
58,negative,Agus-Sylvi,Pendukung #AHY sulit melupakan bully2 seperti ini,dukung agus harimurti yudhoyono sulit lupa bully sepe i,dukung agus hari i yudhoyono sulit lupa bully sepe i
59,negative,Agus-Sylvi,pantas saja #AHY hancur,agus harimurti yudhoyono hancur,agus hari i yudhoyono hancur
60,negative,Agus-Sylvi,"anggap saja bisa, sebulan kemudian pada dijual (pindah tangan) ke orang2 elit partai gerindra dan pks #pilkadadki #ahy",anggap bulan jual pindah tangan orang elite pak ai gerindra partai keadilan sejahtera pilkadadki agus harimurti yudhoyono,anggap jual pindah tangan orang elite ai gerindra pak ai adil sejahtera pilkadadki agus hari i yudhoyono
61,negative,Agus-Sylvi,"#AHY, antasari, konferensi pers sby, sby, Konferensi Pers SBY seperti Rengekan Anak Kecil",agus harimurti yudhoyono antasari konferensi pers susilo bambang yudhoyono susilo bambang yudhoyono konferensi pers susilo bambang yudhoyono sepe i rengek anak,agus hari i yudhoyono antasari konferensi pers susilo bambang yudhoyono susilo bambang yudhoyono konferensi pers susilo bambang yudhoyono sepe i rengek anak
62,negative,Agus-Sylvi,Tim yang tidak pernah tidur #ahy,tim tidur agus harimurti yudhoyono,tim tidur agus hari i yudhoyono
63,negative,Agus-Sylvi,Coba beretika bila ingin dukungan dari konstituen setia #AHY. Jangan menipu dengan membuat meme dan berita palsu. Rachland Nashidik,coba etika dukung konstituen setia agus harimurti yudhoyono tipu meme berita palsu rachland nashidik,coba etika dukung konstituen setia agus hari i yudhoyono tipu meme berita palsu rachland nashidik
64,negative,Agus-Sylvi,"Kasihan #AHY ,, Tidak menyadari ada musuh dalam sarung Selfienya sebagai motivasi terselubung hmmm.",kasihan agus harimurti yudhoyono sadar musuh sarung selfienya motivasi selubung hmmm,kasihan agus hari i yudhoyono sadar musuh sarung selfienya motivasi selubung hmmm
65,negative,Agus-Sylvi,amieeennnnn dan tidak lupa dengan janji2 manis saat kampanye..#AHY Sang Mayor Sejati,amieeennnnn lupa janji manis kampanye agus harimurti yudhoyono sang mayor sejati,amieeennnnn lupa janji manis kampanye agus hari i yudhoyono sang mayor sejati
66,negative,Agus-Sylvi,"Pada Pilkada DKI, AHY dan SBY jadi target hoax dan fitnah yang dilakukan akun-akun pendukung Ahok.",pilihan kepala daerah daerah khusus ibukota agus harimurti yudhoyono susilo bambang yudhoyono target hoaks fitnah akun akun dukung ahok,pilih kepala daerah daerah khusus ibu kota agus hari i yudhoyono susilo bambang yudhoyono target hoaks fitnah akun akun dukung ahok
67,negative,Agus-Sylvi,"AHY masih mentah tapi mau dikarbit demokrat, melihat pilkada dki mereka tahu bahwa kemenangan pemilu cukup memakai sentimen sara saja",agus harimurti yudhoyono mentah dikarbit demokrat pilihan kepala daerah daerah khusus ibukota menang milu pakai sentimen sara,agus hari i yudhoyono mentah dikarbit demokrat pilih kepala daerah daerah khusus ibu kota menang milu pakai sentimen sara
68,negative,Agus-Sylvi,"Akibat pernyataan Antasari, suara AHY melorot pada Pilkada DKI.",akibat nyata antasari suara agus harimurti yudhoyono lorot pilihan kepala daerah daerah khusus ibukota,akibat nyata antasari suara agus hari i yudhoyono lorot pilih kepala daerah daerah khusus ibu kota
69,negative,Agus-Sylvi,"Enam bulan kampanye pilkada di kubu AHY, pendukung Ahok sibuk serang program AHY. Tidak pernah mereka kampanye program Ahok sendiri",enam kampanye pilihan kepala daerah kubu agus harimurti yudhoyono dukung ahok sibuk serang program agus harimurti yudhoyono kampanye program ahok,enam kampanye pilih kepala daerah kubu agus hari i yudhoyono dukung ahok sibuk serang program agus hari i yudhoyono kampanye program ahok
70,negative,Agus-Sylvi,(13) namun apa yang dicontohkan AHY dan pendukungnya tak terjadi paska putaran kedua Pilkada DKI Jakarta. Perentangan menjadi semakin tajam.,contoh agus harimurti yudhoyono dukung paska putar pilihan kepala daerah daerah khusus ibukota jaka a rentang tajam,contoh agus hari i yudhoyono dukung paska putar pilih kepala daerah daerah khusus ibu kota jaka a rentang tajam
71,negative,Agus-Sylvi,AHY dan Tim berjalan menjauh dari hiruk pikuk Pilkada. Melanjutkan perjalanan panjang politik mereka dengan rasa kecewa @panca66 @bambangelf,agus harimurti yudhoyono tim jalan jauh hiruk pikuk pilihan kepala daerah lanjut jalan politik kecewa panca bambangelf,agus hari i yudhoyono tim jalan hiruk pikuk pilih kepala daerah jalan politik kecewa panca bambangelf
72,negative,Agus-Sylvi,"Ketika AHY kalah & berpidato, semua timnya terdiam menangis, lalu setelah itu mereka melepaskan diri dari pilkada DKI. @panca66 @bambangelf",agus harimurti yudhoyono kalah pidato tim diam menang lepas pilihan kepala daerah daerah khusus ibukota panca bambangelf,agus hari i yudhoyono kalah pidato tim diam menang lepas pilih kepala daerah daerah khusus ibu kota panca bambangelf
73,negative,Agus-Sylvi,"sejujurnya penilaian subyektif saya, terlalu cepat bila AHY 2019. Kalah di pilkada bukan modal, tapi catatan negatif.",jujur nilai subyektif cepat agus harimurti yudhoyono kalah pilihan kepala daerah modal catat negatif,jujur nilai subyektif cepat agus hari i yudhoyono kalah pilih kepala daerah modal catat negatif
74,negative,Agus-Sylvi,Tolak bajingan tengik AHY tukang sogok pemilih ini. Bangsat AHY ini sungguh berbahaya,tolak bajing tengik agus harimurti yudhoyono tukang sogok pilih bangsat agus harimurti yudhoyono sungguh bahaya,tolak bajing tengik agus hari i yudhoyono tukang sogok pilih bangsat agus hari i yudhoyono sungguh bahaya
75,negative,Agus-Sylvi,tolak ahy yang berpolitik membawa agama #AHYMaininSARA,tolak agus harimurti yudhoyono politik bawa agama ahymaininsara,tolak agus hari i yudhoyono politik bawa agama ahymaininsara
76,negative,Agus-Sylvi,"Astaga ini pendukung AHY tidak terima sekali dengan hasil survey,harusnya jadi tolak acuan untuk lebih semangat #efeknontonmetro",astaga dukung agus harimurti yudhoyono terima hasil survei tolak acu semangat efeknontonmetro,astaga dukung agus hari i yudhoyono terima hasil survei tolak acu semangat efeknontonmetro
77,negative,Agus-Sylvi,"Sah-sah aja, Justru itu menjadi tolak ukur kedewasaan warga dki, kalo AHY menang artinya pola pikir warga masih primitif.. #PolitikUangAHY",sah sah saja tolak ukur dewasa warga daerah khusus ibukota kalau agus harimurti yudhoyono menang a inya pola pikir warga primitif politikuangahy,sah sah tolak ukur dewasa warga daerah khusus ibu kota agus hari i yudhoyono menang a inya pola pikir warga primitif politikuangahy
78,negative,Agus-Sylvi,Suara Warga Cuma Dihargai SEMBAKO TOLAK AHY Sudah melakukan penyuapan kepada warga @Abaaah @MurtadhaOne @RinjaniJB @fariz1234 @ananghijau,suara warga harga sembako tolak agus harimurti yudhoyono suap warga abaaah mu adhaone rinjanijb fariz ananghijau,suara warga harga sembako tolak agus hari i yudhoyono suap warga abaaah mu adhaone rinjanijb fariz ananghijau
79,negative,Agus-Sylvi,Sejak AHY tidak ikut pilkada lagi sudah tidak asyik ya,agus harimurti yudhoyono pilihan kepala daerah asyik ya,agus hari i yudhoyono pilih kepala daerah asyik ya
80,negative,Agus-Sylvi,tinggal seleksi tendemnya. Di pilkada DKI AHY kalah karena tendemnya salah pilih. Malah mengurangi kualitas AHY,tinggal seleksi tendemnya pilihan kepala daerah daerah khusus ibukota agus harimurti yudhoyono kalah tendemnya salah pilih kurang kualitas agus harimurti yudhoyono,tinggal seleksi tendemnya pilih kepala daerah daerah khusus ibu kota agus hari i yudhoyono kalah tendemnya salah pilih kualitas agus hari i yudhoyono
81,negative,Agus-Sylvi,Ternyata segelintir pendukung AHY merasa ditikung di saat terakhir karena adanya tweet dari akun resmi parpol pendukung Anies-Sandi #Pilkada,gelintir dukung agus harimurti yudhoyono tikung twit akun resmi partai politik dukung anies sandi pilihan kepala daerah,gelintir dukung agus hari i yudhoyono tikung twit akun resmi pak ai politik dukung anies sandi pilih kepala daerah
82,negative,Agus-Sylvi,AHY Menanggung Akibat Cuitan Ayahnya yang Tak Produktif.,agus harimurti yudhoyono tanggung akibat cuit ayah produktif,agus hari i yudhoyono tanggung akibat cuit ayah produktif
83,negative,Agus-Sylvi,"kering sudah darah @ahy saatnya menghisap darah @anisandi mumpung stok darahnya bergudang-gudang, darah hantu diminum setan #pilkadadki",kering darah agus harimurti yudhoyono menghisap darah anisandi mumpung stok darah gudang gudang darah hantu minum setan pilkadadki,kering darah agus hari i yudhoyono menghisap darah anisandi mumpung stok darah gudang gudang darah hantu minum setan pilkadadki
